{
  "schemaId": "urn:gala:schema:lock:2.0.0",
  "schemaVersion": "2.0.0",
  "repositorySchemaVersion": "2.0.0",
  "resolvedAt": "2026-09-13T12:00:00.000Z",
  "resolver": {
    "package": "@rathnasgala2/publish-action",
    "version": "2.0.0",
    "integrity": "sha256:0000000000000000000000000000000000000000000000000000000000000001",
    "registry": "https://fixture-1.example.com/"
  },
  "schemas": {
    "package": "@rathnasgala2/schemas",
    "version": "2.0.0",
    "integrity": "sha256:0000000000000000000000000000000000000000000000000000000000000001",
    "registry": "https://fixture-1.example.com/",
    "contractVersion": "2.0.0",
    "compatibleWith": "^2.0.0"
  },
  "template": {
    "package": "@rathnasgala2/template",
    "version": "2.0.0",
    "integrity": "sha256:0000000000000000000000000000000000000000000000000000000000000001",
    "registry": "https://fixture-1.example.com/",
    "contractVersion": "2.0.0",
    "compatibleWith": "^2.0.0",
    "templateModules": []
  },
  "theme": {
    "package": "@rathnasgala2/theme-default",
    "version": "2.0.0",
    "integrity": "sha256:0000000000000000000000000000000000000000000000000000000000000001",
    "registry": "https://fixture-1.example.com/",
    "contractVersion": "2.0.0",
    "compatibleWith": "^2.0.0"
  },
  "publisher": [
    {
      "package": "@rathnasgala2/publish-action",
      "version": "2.0.0",
      "integrity": "sha256:0000000000000000000000000000000000000000000000000000000000000001",
      "registry": "https://fixture-1.example.com/",
      "contractVersion": "2.0.0",
      "compatibleWith": "^2.0.0"
    },
    {
      "package": "@rathnasgala2/publish-kernel",
      "version": "2.0.0",
      "integrity": "sha256:0000000000000000000000000000000000000000000000000000000000000002",
      "registry": "https://fixture-2.example.com/",
      "contractVersion": "2.0.0",
      "compatibleWith": "^2.0.0"
    },
    {
      "package": "@rathnasgala2/adapter-protocol",
      "version": "2.0.0",
      "integrity": "sha256:0000000000000000000000000000000000000000000000000000000000000003",
      "registry": "https://fixture-3.example.com/",
      "contractVersion": "2.0.0",
      "compatibleWith": "^2.0.0"
    },
    {
      "package": "@rathnasgala2/adapter-local-directory",
      "version": "2.0.0",
      "integrity": "sha256:0000000000000000000000000000000000000000000000000000000000000004",
      "registry": "https://fixture-4.example.com/",
      "contractVersion": "2.0.0",
      "compatibleWith": "^2.0.0"
    }
  ],
  "dependencies": [
    {
      "package": "fixture-1",
      "version": "2.0.0",
      "integrity": "sha256:0000000000000000000000000000000000000000000000000000000000000001",
      "registry": "https://fixture-1.example.com/"
    }
  ],
  "dependencyDag": [
    {
      "from": "@rathnasgala2/fixture-1@2.0.0",
      "to": "@rathnasgala2/fixture-1@2.0.0"
    }
  ],
  "lockDigest": "sha256:0000000000000000000000000000000000000000000000000000000000000001"
}
